{
  "state_version": "1.0",
  "updated_at": "2026-02-11T04:09:22Z",
  "active_goals": [],
  "commitments": [],
  "artifacts": [],
  "beliefs": [],
  "uncertainties": [],
  "current_plan": [],
  "policies": [],
  "tool_models": {
    "flaky_tool": {
      "reliability": 0.8,
      "failure_modes": ["fail-once first call"],
      "constraints": ["retry once; second call succeeds with same state file"]
    }
  },
  "last_session_summary": "",
  "run_nonce": "6d80b711-e2a6-4f0e-91fe-a2a4896025f0",
  "pending_citations": []
}
